{
 "$schema":"https://json-schema.org/draft/2020-12/schema","type":"object","additionalProperties":false,
 "required":["governs","schemaVersion","executionEnabled","privilegedWrites","followReparsePoints","maxRows","maxEntries","maxSeconds","largeMinimumMB","levels","orphanVendorRules","backupRequiredForUserData","systemProviderMode"],
 "properties":{"$schema":{"type":"string"},"governs":{"const":"product_runtime"},"schemaVersion":{"const":1},"executionEnabled":{"const":false},"privilegedWrites":{"const":false},"followReparsePoints":{"const":false},"maxRows":{"type":"integer","minimum":1,"maximum":5000},"maxEntries":{"type":"integer","minimum":1,"maximum":100000},"maxSeconds":{"type":"integer","minimum":1,"maximum":120},"largeMinimumMB":{"type":"integer","minimum":1},"levels":{"type":"array","minItems":3,"maxItems":3,"items":{"type":"object","additionalProperties":false,"required":["id","tempDays","logDays"],"properties":{"id":{"type":"integer","minimum":1,"maximum":3},"tempDays":{"type":"integer","minimum":1},"logDays":{"type":"integer","minimum":1}}}},"orphanVendorRules":{"type":"array","maxItems":0},"backupRequiredForUserData":{"const":true},"systemProviderMode":{"const":"WindowsDelegated"}}
}
